### ISSUE TITLE
SSL connection to external website does not work

### ISSUE THREAD

**Issue by alexey-milovidov** [ClickHouse/ClickHouse#10055]
**Describe the bug**
```
$ clickhouse-local --query "SELECT count() FROM url('https://data.gharchive.org/2015-01-01-15.json.gz', TSV, 'data String')"
SSL Exception: error:14000410:SSL routines::sslv3 alert handshake failure
```

**Comment by filimonov** [comment]
Most probably the issue with root certs & paths.

**Comment by filimonov** [comment]
It seems like installing ca-certificates, and ajusting path don't help. So it's 99% chances - the fault is pre-alpha version of openssl used by clickhouse. 

BTW. 3.0.Alpha1 was released yesterday.
https://www.openssl.org/blog/blog/2020/04/23/OpenSSL3.0Alpha1/

**Comment by filimonov** [comment]
```
openssl s_client -state -nbio -connect data.gharchive.org:443
CONNECTED(00000005)
Turned on non blocking io
SSL_connect:before SSL initialization
SSL_connect:SSLv3/TLS write client hello
SSL_connect:error in SSLv3/TLS write client hello
write R BLOCK
SSL_connect:SSLv3/TLS write client hello
SSL_connect:SSLv3/TLS read server hello
SSL_connect:TLSv1.3 read encrypted extensions
depth=2 C = IE, O = Baltimore, OU = CyberTrust, CN = Baltimore CyberTrust Root
verify return:1
depth=1 C = US, ST = CA, L = San Francisco, O = "CloudFlare, Inc.", CN = CloudFlare Inc ECC CA-2
verify return:1
depth=0 C = US, ST = CA, L = San Francisco, O = "Cloudflare, Inc.", CN = sni.cloudflaressl.com
verify return:1
SSL_connect:SSLv3/TLS read server certificate
SSL_connect:TLSv1.3 read server certificate verify
SSL_connect:SSLv3/TLS read finished
SSL_connect:SSLv3/TLS write change cipher spec
SSL_connect:SSLv3/TLS write finished
read R BLOCK
---
Certificate chain
 0 s:C = US, ST = CA, L = San Francisco, O = "Cloudflare, Inc.", CN = sni.cloudflaressl.com
   i:C = US, ST = CA, L = San Francisco, O = "CloudFlare, Inc.", CN = CloudFlare Inc ECC CA-2
 1 s:C = US, ST = CA, L = San Francisco, O = "CloudFlare, Inc.", CN = CloudFlare Inc ECC CA-2
   i:C = IE, O = Baltimore, OU = CyberTrust, CN = Baltimore CyberTrust Root
---
Server certificate
-----BEGIN CERTIFICATE-----
MIIE6jCCBI+gAwIBAgIQC7UTpnftjgb3ChytJ28f6jAKBggqhkjOPQQDAjBvMQsw
CQYDVQQGEwJVUzELMAkGA1UECBMCQ0ExFjAUBgNVBAcTDVNhbiBGcmFuY2lzY28x
GTAXBgNVBAoTEENsb3VkRmxhcmUsIEluYy4xIDAeBgNVBAMTF0Nsb3VkRmxhcmUg
SW5jIEVDQyBDQS0yMB4XDTIwMDIwNDAwMDAwMFoXDTIwMTAwOTEyMDAwMFowbTEL
MAkGA1UEBhMCVVMxCzAJBgNVBAgTAkNBMRYwFAYDVQQHEw1TYW4gRnJhbmNpc2Nv
MRkwFwYDVQQKExBDbG91ZGZsYXJlLCBJbmMuMR4wHAYDVQQDExVzbmkuY2xvdWRm
bGFyZXNzbC5jb20wWTATBgcqhkjOPQIBBggqhkjOPQMBBwNCAAR1QhLXmodIphse
JlxCkNyhmqwflbdFd+x4M+DZVH4ugTkfy3142hrnYMLHe09miw9KrYxsgH1TOC38
peZIme1Ro4IDDTCCAwkwHwYDVR0jBBgwFoAUPnQtH89FdQR+P8Cihz5MQ4NRE8Yw
HQYDVR0OBBYEFIvI/uenaFpp/PgDFxwxXhhLvoJZMEAGA1UdEQQ5MDeCDWdoYXJj
aGl2ZS5vcmeCFXNuaS5jbG91ZGZsYXJlc3NsLmNvbYIPKi5naGFyY2hpdmUub3Jn
MA4GA1UdDwEB/wQEAwIHgDAdBgNVHSUEFjAUBggrBgEFBQcDAQYIKwYBBQUHAwIw
eQYDVR0fBHIwcDA2oDSgMoYwaHR0cDovL2NybDMuZGlnaWNlcnQuY29tL0Nsb3Vk
RmxhcmVJbmNFQ0NDQTIuY3JsMDagNKAyhjBodHRwOi8vY3JsNC5kaWdpY2VydC5j
b20vQ2xvdWRGbGFyZUluY0VDQ0NBMi5jcmwwTAYDVR0gBEUwQzA3BglghkgBhv1s
AQEwKjAoBggrBgEFBQcCARYcaHR0cHM6Ly93d3cuZGlnaWNlcnQuY29tL0NQUzAI
BgZngQwBAgIwdgYIKwYBBQUHAQEEajBoMCQGCCsGAQUFBzABhhhodHRwOi8vb2Nz
cC5kaWdpY2VydC5jb20wQAYIKwYBBQUHMAKGNGh0dHA6Ly9jYWNlcnRzLmRpZ2lj
ZXJ0LmNvbS9DbG91ZEZsYXJlSW5jRUNDQ0EtMi5jcnQwDAYDVR0TAQH/BAIwADCC
AQUGCisGAQQB1nkCBAIEgfYEgfMA8QB3AKS5CZC0GFgUh7sTosxncAo8NZgE+Rvf
uON3zQ7IDdwQAAABcBCbMH0AAAQDAEgwRgIhAIE5qxNObtb8fnbTsTDgjNLOEDo6
PzwaCzoqCAypxtA0AiEA9XTC//IQqsVblPc9Apx1JOFB+3xV4q6t9+M1YFaWsTQA
dgBep3P531bA57U2SH3QSeAyepGaDIShEhKEGHWWgXFFWAAAAXAQmzAoAAAEAwBH
MEUCIQDusO0LklhCRgZXgrTjQ+Cf1uq2XPoOWi1FF4aT8DUZogIgaleI36Q1kiTN
gKdjyvvNhhErI7joFMEByrDcV0P9nwIwCgYIKoZIzj0EAwIDSQAwRgIhAIIHxWkc
uSmuTSv59k8OKHSudgpFmPM6ZpHmaTE0WqsPAiEAtLv52yIMb70UEWVLD92U9DR3
kODAtI6+LX5Y5zR/a2k=
-----END CERTIFICATE-----
subject=C = US, ST = CA, L = San Francisco, O = "Cloudflare, Inc.", CN = sni.cloudflaressl.com

issuer=C = US, ST = CA, L = San Francisco, O = "CloudFlare, Inc.", CN = CloudFlare Inc ECC CA-2

---
No client certificate CA names sent
Peer signing digest: SHA256
Peer signature type: ECDSA
Server Temp Key: X25519, 253 bits
---
SSL handshake has read 2512 bytes and written 400 bytes
Verification: OK
---
New, TLSv1.3, Cipher is TLS_AES_256_GCM_SHA384
Server public key is 256 bit
Secure Renegotiation IS NOT supported
Compression: NONE
Expansion: NONE
No ALPN negotiated
Early data was not sent
Verify return code: 0 (ok)
---
SSL_connect:SSL negotiation finished successfully
SSL_connect:SSL negotiation finished successfully
---
Post-Handshake New Session Ticket arrived:
SSL-Session:
    Protocol  : TLSv1.3
    Cipher    : TLS_AES_256_GCM_SHA384
    Session-ID: 85CB495D617069611C86ECD3EB77BE7A3945DCD4D353364818FFD43E2E1D0452
    Session-ID-ctx: 
    Resumption PSK: 82650034E15D551F47F4D13CC0088E5DC8FF90CC4B4E5BCF076137D0E251FE3CE884CA951BB0AC62B8C48C6E4DBFC01A
    PSK identity: None
    PSK identity hint: None
    SRP username: None
    TLS session ticket lifetime hint: 64800 (seconds)
    TLS session ticket:
    0000 - 8e 3b 94 a1 09 e4 74 c0-52 bc 76 4a b3 19 3b 0a   .;....t.R.vJ..;.
    0010 - a1 1d 5f 75 ec a1 76 a8-3b ad ba 11 b9 62 a7 99   .._u..v.;....b..
    0020 - a8 45 85 29 ca 06 f4 de-e9 68 20 94 5a 6b 0c 8b   .E.).....h .Zk..
    0030 - 2b f3 38 c0 f0 18 79 f4-f8 a6 4f 69 1a bc 58 1f   +.8...y...Oi..X.
    0040 - 38 a4 9d 5a 7c ae e8 47-b8 49 53 a8 9c c5 16 93   8..Z|..G.IS.....
    0050 - a9 e8 a1 1a 52 30 76 bb-fc 20 88 9d 6b 1e 90 fe   ....R0v.. ..k...
    0060 - 1a 4a e0 d1 c5 ba 29 bf-ba f9 6b 22 dc b3 f0 d1   .J....)...k"....
    0070 - db fe e0 c3 72 5f ee 7f-f4 61 99 db fa 74 59 fb   ....r_...a...tY.
    0080 - bf ca bb db 52 67 e7 d3-d8 35 94 a5 9a a4 35 e0   ....Rg...5....5.
    0090 - 71 e0 a9 41 4c 96 3b f8-03 ec f1 89 6c 9c bd 83   q..AL.;.....l...
    00a0 - 88 77 53 62 9e 9b 35 d5-16 cf f3 69 5f 07 27 06   .wSb..5....i_.'.
    00b0 - 16 e8 12 11 72 74 cc 70-99 6d b3 9b dd b5 dc 87   ....rt.p.m......

    Start Time: 1587719441
    Timeout   : 7200 (sec)
    Verify return code: 0 (ok)
    Extended master secret: no
    Max Early Data: 0
---
SSL_connect:SSLv3/TLS read server session ticket
read R BLOCK
SSL_connect:SSL negotiation finished successfully
SSL_connect:SSL negotiation finished successfully
---
Post-Handshake New Session Ticket arrived:
SSL-Session:
    Protocol  : TLSv1.3
    Cipher    : TLS_AES_256_GCM_SHA384
    Session-ID: E64E6652B2797D961474B6C35E8E38FEF2F86E6DE52B0F6B25B1491D3AA77ECB
    Session-ID-ctx: 
    Resumption PSK: 676B4B11BD950C2C17BA7A746F312ACD0AF6248ACE7E1031EA2102D66C4DBDDCC675D7C375DF02B2562A4441C58892D1
    PSK identity: None
    PSK identity hint: None
    SRP username: None
    TLS session ticket lifetime hint: 64800 (seconds)
    TLS session ticket:
    0000 - 8e 3b 94 a1 09 e4 74 c0-52 bc 76 4a b3 19 3b 0a   .;....t.R.vJ..;.
    0010 - 13 74 d6 31 b3 26 92 a0-91 43 ab a9 f8 6c 87 a2   .t.1.&...C...l..
    0020 - 3b 18 ff 73 8b 75 d9 84-b3 71 48 eb 0e 8b 0b 08   ;..s.u...qH.....
    0030 - 68 01 c9 dd b8 c7 c5 bb-bf 9a 80 bf db 19 da 3f   h..............?
    0040 - 32 5f e2 7f 15 cf ac 0c-0f 01 97 ac e5 b0 3c 9f   2_............<.
    0050 - a3 0b e0 8c 24 91 28 21-25 e3 db a5 9c 34 5c ca   ....$.(!%....4\.
    0060 - f5 c7 d1 24 bf 60 e2 c6-21 47 ba fa b2 0a b0 74   ...$.`..!G.....t
    0070 - 5d cf 4f 42 2a 68 20 12-63 aa be a3 81 42 50 fa   ].OB*h .c....BP.
    0080 - f7 a2 44 12 97 12 66 29-af 9f ae 8f 3e 02 f0 01   ..D...f)....>...
    0090 - de de 2d d6 94 cb e7 97-e6 ff 57 f5 94 06 1b 40   ..-.......W....@
    00a0 - a5 fb 0b 94 57 85 60 bd-b9 89 ad bc fa 04 09 94   ....W.`.........
    00b0 - 5d 5b 23 1a ea 97 de 84-be d6 9d 5a 21 a4 0b 6d   ][#........Z!..m

    Start Time: 1587719441
    Timeout   : 7200 (sec)
    Verify return code: 0 (ok)
    Extended master secret: no
    Max Early Data: 0
---
SSL_connect:SSLv3/TLS read server session ticket
read R BLOCK
SSL3 alert read:warning:close notify
closed
SSL3 alert write:warning:close notify
```

**Comment by alexey-milovidov** [comment]
@filimonov I get the same error if ClickHouse is compiled with OpenSSL 1.1.1.

**Comment by filimonov** [comment]
> @filimonov I get the same error if ClickHouse is compiled with OpenSSL 1.1.1.

In the meanwhile i've also checked the connection with openssl 3 cli and it also worked. :\

**Comment by alexey-milovidov** [comment]
It does not work even if we replace OpenSSL to BoringSSL with the similar error:
`SSL Exception: error:10000410:SSL routines:OPENSSL_internal:SSLV3_ALERT_HANDSHAKE_FAILURE`

**Comment by alexey-milovidov** [comment]
Most likely this is a bug in Poco library.

**Comment by alexey-milovidov** [comment]
Trivial examples work fine:

```
SELECT * FROM url('https://yandex.ru/', RawBLOB, 'data String')
SELECT * FROM url('https://www.google.com/', RawBLOB, 'data String')
```

**Comment by alexey-milovidov** [comment]
TCPDump (Wireshark) from OpenSSL client:
```
OpenSSL:

Frame 4: 370 bytes on wire (2960 bits), 370 bytes captured (2960 bits)
    Encapsulation type: Raw IP (7)
    Arrival Time: Oct 22, 2020 03:48:48.573366000 MSK
    [Time shift for this packet: 0.000000000 seconds]
    Epoch Time: 1603327728.573366000 seconds
    [Time delta from previous captured frame: 0.000219000 seconds]
    [Time delta from previous displayed frame: 0.000219000 seconds]
    [Time since reference or first frame: 0.007858000 seconds]
    Frame Number: 4
    Frame Length: 370 bytes (2960 bits)
    Capture Length: 370 bytes (2960 bits)
    [Frame is marked: False]
    [Frame is ignored: False]
    [Protocols in frame: raw:ipv6:tcp:tls]
    [Coloring Rule Name: TCP]
    [Coloring Rule String: tcp]
Raw packet data
Internet Protocol Version 6, Src: 2a02:6b8:b080:6605::1:2, Dst: 2606:4700:3037::6812:36d8
    0110 .... = Version: 6
    .... 0000 0000 .... .... .... .... .... = Traffic Class: 0x00 (DSCP: CS0, ECN: Not-ECT)
        .... 0000 00.. .... .... .... .... .... = Differentiated Services Codepoint: Default (0)
        .... .... ..00 .... .... .... .... .... = Explicit Congestion Notification: Not ECN-Capable Transport (0)
    .... .... .... 1011 0010 1100 1000 0000 = Flow Label: 0xb2c80
    Payload Length: 330
    Next Header: TCP (6)
    Hop Limit: 64
    Source: 2a02:6b8:b080:6605::1:2
    Destination: 2606:4700:3037::6812:36d8
Transmission Control Protocol, Src Port: 45330, Dst Port: 443, Seq: 1, Ack: 1, Len: 310
    Source Port: 45330
    Destination Port: 443
    [Stream index: 0]
    [TCP Segment Len: 310]
    Sequence number: 1    (relative sequence number)
    Sequence number (raw): 2397070429
    [Next sequence number: 311    (relative sequence number)]
    Acknowledgment number: 1    (relative ack number)
    Acknowledgment number (raw): 2812924377
    0101 .... = Header Length: 20 bytes (5)
    Flags: 0x018 (PSH, ACK)
        000. .... .... = Reserved: Not set
        ...0 .... .... = Nonce: Not set
        .... 0... .... = Congestion Window Reduced (CWR): Not set
        .... .0.. .... = ECN-Echo: Not set
        .... ..0. .... = Urgent: Not set
        .... ...1 .... = Acknowledgment: Set
        .... .... 1... = Push: Set
        .... .... .0.. = Reset: Not set
        .... .... ..0. = Syn: Not set
        .... .... ...0 = Fin: Not set
        [TCP Flags: ·······AP···]
    Window size value: 507
    [Calculated window size: 64896]
    [Window size scaling factor: 128]
    Checksum: 0x83df [unverified]
    [Checksum Status: Unverified]
    Urgent pointer: 0
    [SEQ/ACK analysis]
        [iRTT: 0.007639000 seconds]
        [Bytes in flight: 310]
        [Bytes sent since last PSH flag: 310]
    [Timestamps]
        [Time since first frame in this TCP stream: 0.007858000 seconds]
        [Time since previous frame in this TCP stream: 0.000219000 seconds]
    TCP payload (310 bytes)
Transport Layer Security
    TLSv1.3 Record Layer: Handshake Protocol: Client Hello
        Content Type: Handshake (22)
        Version: TLS 1.0 (0x0301)
        Length: 305
        Handshake Protocol: Client Hello
            Handshake Type: Client Hello (1)
            Length: 301
            Version: TLS 1.2 (0x0303)
            Random: 6ba34aa09ebc857880f290e127b9c6e8333712f58c0ec11d…

            
            Session ID Length: 32
            Session ID: 4512e521d242c6f39b4b113bda25151b22a3404facd335db…
            Cipher Suites Length: 62
            Cipher Suites (31 suites)
                Cipher Suite: TLS_AES_256_GCM_SHA384 (0x1302)
                Cipher Suite: TLS_CHACHA20_POLY1305_SHA256 (0x1303)
                Cipher Suite: TLS_AES_128_GCM_SHA256 (0x1301)
                Cipher Suite: TLS_ECDHE_ECDSA_WITH_AES_256_GCM_SHA384 (0xc02c)
                Cipher Suite: TLS_ECDHE_RSA_WITH_AES_256_GCM_SHA384 (0xc030)
                Cipher Suite: TLS_DHE_RSA_WITH_AES_256_GCM_SHA384 (0x009f)
                Cipher Suite: TLS_ECDHE_ECDSA_WITH_CHACHA20_POLY1305_SHA256 (0xcca9)
                Cipher Suite: TLS_ECDHE_RSA_WITH_CHACHA20_POLY1305_SHA256 (0xcca8)
                Cipher Suite: TLS_DHE_RSA_WITH_CHACHA20_POLY1305_SHA256 (0xccaa)
                Cipher Suite: TLS_ECDHE_ECDSA_WITH_AES_128_GCM_SHA256 (0xc02b)
                Cipher Suite: TLS_ECDHE_RSA_WITH_AES_128_GCM_SHA256 (0xc02f)
                Cipher Suite: TLS_DHE_RSA_WITH_AES_128_GCM_SHA256 (0x009e)
                Cipher Suite: TLS_ECDHE_ECDSA_WITH_AES_256_CBC_SHA384 (0xc024)
                Cipher Suite: TLS_ECDHE_RSA_WITH_AES_256_CBC_SHA384 (0xc028)
                Cipher Suite: TLS_DHE_RSA_WITH_AES_256_CBC_SHA256 (0x006b)
                Cipher Suite: TLS_ECDHE_ECDSA_WITH_AES_128_CBC_SHA256 (0xc023)
                Cipher Suite: TLS_ECDHE_RSA_WITH_AES_128_CBC_SHA256 (0xc027)
                Cipher Suite: TLS_DHE_RSA_WITH_AES_128_CBC_SHA256 (0x0067)
                Cipher Suite: TLS_ECDHE_ECDSA_WITH_AES_256_CBC_SHA (0xc00a)
                Cipher Suite: TLS_ECDHE_RSA_WITH_AES_256_CBC_SHA (0xc014)
                Cipher Suite: TLS_DHE_RSA_WITH_AES_256_CBC_SHA (0x0039)
                Cipher Suite: TLS_ECDHE_ECDSA_WITH_AES_128_CBC_SHA (0xc009)
                Cipher Suite: TLS_ECDHE_RSA_WITH_AES_128_CBC_SHA (0xc013)
                Cipher Suite: TLS_DHE_RSA_WITH_AES_128_CBC_SHA (0x0033)
                Cipher Suite: TLS_RSA_WITH_AES_256_GCM_SHA384 (0x009d)
                Cipher Suite: TLS_RSA_WITH_AES_128_GCM_SHA256 (0x009c)
                Cipher Suite: TLS_RSA_WITH_AES_256_CBC_SHA256 (0x003d)
                Cipher Suite: TLS_RSA_WITH_AES_128_CBC_SHA256 (0x003c)
                Cipher Suite: TLS_RSA_WITH_AES_256_CBC_SHA (0x0035)
                Cipher Suite: TLS_RSA_WITH_AES_128_CBC_SHA (0x002f)
                Cipher Suite: TLS_EMPTY_RENEGOTIATION_INFO_SCSV (0x00ff)
            Compression Methods Length: 1
            Compression Methods (1 method)
                Compression Method: null (0)
            Extensions Length: 166
            Extension: server_name (len=23)
                Type: server_name (0)
                Length: 23
                Server Name Indication extension
                    Server Name list length: 21
                    Server Name Type: host_name (0)
                    Server Name length: 18
                    Server Name: data.gharchive.org
            Extension: ec_point_formats (len=4)
                Type: ec_point_formats (11)
                Length: 4
                EC point formats Length: 3
                Elliptic curves point formats (3)
                    EC point format: uncompressed (0)
                    EC point format: ansiX962_compressed_prime (1)
                    EC point format: ansiX962_compressed_char2 (2)
            Extension: supported_groups (len=12)
                Type: supported_groups (10)
                Length: 12
                Supported Groups List Length: 10
                Supported Groups (5 groups)
                    Supported Group: x25519 (0x001d)
                    Supported Group: secp256r1 (0x0017)
                    Supported Group: x448 (0x001e)
                    Supported Group: secp521r1 (0x0019)
                    Supported Group: secp384r1 (0x0018)
            Extension: session_ticket (len=0)
                Type: session_ticket (35)
                Length: 0
                Data (0 bytes)
            Extension: encrypt_then_mac (len=0)
                Type: encrypt_then_mac (22)
                Length: 0
            Extension: extended_master_secret (len=0)
                Type: extended_master_secret (23)
                Length: 0
            Extension: signature_algorithms (len=42)
                Type: signature_algorithms (13)
                Length: 42
                Signature Hash Algorithms Length: 40
                Signature Hash Algorithms (20 algorithms)
                    Signature Algorithm: ecdsa_secp256r1_sha256 (0x0403)
                        Signature Hash Algorithm Hash: SHA256 (4)
                        Signature Hash Algorithm Signature: ECDSA (3)
                    Signature Algorithm: ecdsa_secp384r1_sha384 (0x0503)
                        Signature Hash Algorithm Hash: SHA384 (5)
                        Signature Hash Algorithm Signature: ECDSA (3)
                    Signature Algorithm: ecdsa_secp521r1_sha512 (0x0603)
                        Signature Hash Algorithm Hash: SHA512 (6)
                        Signature Hash Algorithm Signature: ECDSA (3)
                    Signature Algorithm: ed25519 (0x0807)
                        Signature Hash Algorithm Hash: Unknown (8)
                        Signature Hash Algorithm Signature: Unknown (7)
                    Signature Algorithm: ed448 (0x0808)
                        Signature Hash Algorithm Hash: Unknown (8)
                        Signature Hash Algorithm Signature: Unknown (8)
                    Signature Algorithm: rsa_pss_pss_sha256 (0x0809)
                        Signature Hash Algorithm Hash: Unknown (8)
                        Signature Hash Algorithm Signature: Unknown (9)
                    Signature Algorithm: rsa_pss_pss_sha384 (0x080a)
                        Signature Hash Algorithm Hash: Unknown (8)
                        Signature Hash Algorithm Signature: Unknown (10)
                    Signature Algorithm: rsa_pss_pss_sha512 (0x080b)
                        Signature Hash Algorithm Hash: Unknown (8)
                        Signature Hash Algorithm Signature: Unknown (11)
                    Signature Algorithm: rsa_pss_rsae_sha256 (0x0804)
                        Signature Hash Algorithm Hash: Unknown (8)
                        Signature Hash Algorithm Signature: Unknown (4)
                    Signature Algorithm: rsa_pss_rsae_sha384 (0x0805)
                        Signature Hash Algorithm Hash: Unknown (8)
                        Signature Hash Algorithm Signature: Unknown (5)
                    Signature Algorithm: rsa_pss_rsae_sha512 (0x0806)
                        Signature Hash Algorithm Hash: Unknown (8)
                        Signature Hash Algorithm Signature: Unknown (6)
                    Signature Algorithm: rsa_pkcs1_sha256 (0x0401)
                        Signature Hash Algorithm Hash: SHA256 (4)
                        Signature Hash Algorithm Signature: RSA (1)
                    Signature Algorithm: rsa_pkcs1_sha384 (0x0501)
                        Signature Hash Algorithm Hash: SHA384 (5)
                        Signature Hash Algorithm Signature: RSA (1)
                    Signature Algorithm: rsa_pkcs1_sha512 (0x0601)
                        Signature Hash Algorithm Hash: SHA512 (6)
                        Signature Hash Algorithm Signature: RSA (1)
                    Signature Algorithm: SHA224 ECDSA (0x0303)
                        Signature Hash Algorithm Hash: SHA224 (3)
                        Signature Hash Algorithm Signature: ECDSA (3)
                    Signature Algorithm: SHA224 RSA (0x0301)
                        Signature Hash Algorithm Hash: SHA224 (3)
                        Signature Hash Algorithm Signature: RSA (1)
                    Signature Algorithm: SHA224 DSA (0x0302)
                        Signature Hash Algorithm Hash: SHA224 (3)
                        Signature Hash Algorithm Signature: DSA (2)
                    Signature Algorithm: SHA256 DSA (0x0402)
                        Signature Hash Algorithm Hash: SHA256 (4)
                        Signature Hash Algorithm Signature: DSA (2)
                    Signature Algorithm: SHA384 DSA (0x0502)
                        Signature Hash Algorithm Hash: SHA384 (5)
                        Signature Hash Algorithm Signature: DSA (2)
                    Signature Algorithm: SHA512 DSA (0x0602)
                        Signature Hash Algorithm Hash: SHA512 (6)
                        Signature Hash Algorithm Signature: DSA (2)
            Extension: supported_versions (len=5)
                Type: supported_versions (43)
                Length: 5
                Supported Versions length: 4
                Supported Version: TLS 1.3 (0x0304)
                Supported Version: TLS 1.2 (0x0303)
            Extension: psk_key_exchange_modes (len=2)
                Type: psk_key_exchange_modes (45)
                Length: 2
                PSK Key Exchange Modes Length: 1
                PSK Key Exchange Mode: PSK with (EC)DHE key establishment (psk_dhe_ke) (1)
            Extension: key_share (len=38)
                Type: key_share (51)
                Length: 38
                Key Share extension
                    Client Key Share Length: 36
                    Key Share Entry: Group: x25519, Key Exchange length: 32
                        Group: x25519 (29)
                        Key Exchange Length: 32
                        Key Exchange: cfcc0ae4c6f8d93ea6dba43f694c0309a4749af3df79e338…
  

No client certificate CA names sent
Peer signing digest: SHA256
Peer signature type: ECDSA
Server Temp Key: X25519, 253 bits
---
SSL handshake has read 2515 bytes and written 390 bytes
Verification: OK
---
New, TLSv1.3, Cipher is TLS_AES_256_GCM_SHA384
Server public key is 256 bit
Secure Renegotiation IS NOT supported
Compression: NONE
Expansion: NONE
No ALPN negotiated
Early data was not sent
```

TCPDump (Wireshark) from BoringSSL client:
```
BoringSSL:

Frame 4: 294 bytes on wire (2352 bits), 294 bytes captured (2352 bits)
    Encapsulation type: Raw IP (7)
    Arrival Time: Oct 22, 2020 03:45:21.307091000 MSK
    [Time shift for this packet: 0.000000000 seconds]
    Epoch Time: 1603327521.307091000 seconds
    [Time delta from previous captured frame: 0.000407000 seconds]
    [Time delta from previous displayed frame: 0.000407000 seconds]
    [Time since reference or first frame: 0.007899000 seconds]
    Frame Number: 4
    Frame Length: 294 bytes (2352 bits)
    Capture Length: 294 bytes (2352 bits)
    [Frame is marked: False]
    [Frame is ignored: False]
    [Protocols in frame: raw:ipv6:tcp:tls]
    [Coloring Rule Name: TCP]
    [Coloring Rule String: tcp]
Raw packet data
Internet Protocol Version 6, Src: 2a02:6b8:b080:6605::1:2, Dst: 2606:4700:3035::ac43:a8ce
    0110 .... = Version: 6
    .... 0000 0000 .... .... .... .... .... = Traffic Class: 0x00 (DSCP: CS0, ECN: Not-ECT)
        .... 0000 00.. .... .... .... .... .... = Differentiated Services Codepoint: Default (0)
        .... .... ..00 .... .... .... .... .... = Explicit Congestion Notification: Not ECN-Capable Transport (0)
    .... .... .... 1101 1110 1001 0001 1100 = Flow Label: 0xde91c
    Payload Length: 254
    Next Header: TCP (6)
    Hop Limit: 64
    Source: 2a02:6b8:b080:6605::1:2
    Destination: 2606:4700:3035::ac43:a8ce
Transmission Control Protocol, Src Port: 57774, Dst Port: 443, Seq: 1, Ack: 1, Len: 234
    Source Port: 57774
    Destination Port: 443
    [Stream index: 0]
    [TCP Segment Len: 234]
    Sequence number: 1    (relative sequence number)
    Sequence number (raw): 4088489962
    [Next sequence number: 235    (relative sequence number)]
    Acknowledgment number: 1    (relative ack number)
    Acknowledgment number (raw): 2958684266
    0101 .... = Header Length: 20 bytes (5)
    Flags: 0x018 (PSH, ACK)
        000. .... .... = Reserved: Not set
        ...0 .... .... = Nonce: Not set
        .... 0... .... = Congestion Window Reduced (CWR): Not set
        .... .0.. .... = ECN-Echo: Not set
        .... ..0. .... = Urgent: Not set
        .... ...1 .... = Acknowledgment: Set
        .... .... 1... = Push: Set
        .... .... .0.. = Reset: Not set
        .... .... ..0. = Syn: Not set
        .... .... ...0 = Fin: Not set
        [TCP Flags: ·······AP···]
    Window size value: 507
    [Calculated window size: 64896]
    [Window size scaling factor: 128]
    Checksum: 0xcec3 [unverified]
    [Checksum Status: Unverified]
    Urgent pointer: 0
    [SEQ/ACK analysis]
        [iRTT: 0.007492000 seconds]
        [Bytes in flight: 234]
        [Bytes sent since last PSH flag: 234]
    [Timestamps]
        [Time since first frame in this TCP stream: 0.007899000 seconds]
        [Time since previous frame in this TCP stream: 0.000407000 seconds]
    TCP payload (234 bytes)
Transport Layer Security
    TLSv1 Record Layer: Handshake Protocol: Client Hello
        Content Type: Handshake (22)
        Version: TLS 1.0 (0x0301)
        Length: 229
        Handshake Protocol: Client Hello
            Handshake Type: Client Hello (1)
            Length: 225
            Version: TLS 1.2 (0x0303)
            Random: f2232b901752a503cdec687f67c32077d2b9c20a11b7c53d…
                GMT Unix Time: Sep 24, 2098 12:59:44.000000000 MSK
                Random Bytes: 1752a503cdec687f67c32077d2b9c20a11b7c53d7673fbee…
            Session ID Length: 32
            Session ID: 71f1fdda4f02f46c8d65f699e1455a7aeb05293dc0359cb7…
            Cipher Suites Length: 36
            Cipher Suites (18 suites)
                Cipher Suite: TLS_AES_128_GCM_SHA256 (0x1301)
                Cipher Suite: TLS_AES_256_GCM_SHA384 (0x1302)
                Cipher Suite: TLS_CHACHA20_POLY1305_SHA256 (0x1303)
                Cipher Suite: TLS_ECDHE_ECDSA_WITH_AES_128_GCM_SHA256 (0xc02b)
                Cipher Suite: TLS_ECDHE_RSA_WITH_AES_128_GCM_SHA256 (0xc02f)
                Cipher Suite: TLS_ECDHE_ECDSA_WITH_AES_256_GCM_SHA384 (0xc02c)
                Cipher Suite: TLS_ECDHE_RSA_WITH_AES_256_GCM_SHA384 (0xc030)
                Cipher Suite: TLS_ECDHE_ECDSA_WITH_CHACHA20_POLY1305_SHA256 (0xcca9)
                Cipher Suite: TLS_ECDHE_RSA_WITH_CHACHA20_POLY1305_SHA256 (0xcca8)
                Cipher Suite: TLS_ECDHE_ECDSA_WITH_AES_128_CBC_SHA (0xc009)
                Cipher Suite: TLS_ECDHE_RSA_WITH_AES_128_CBC_SHA (0xc013)
                Cipher Suite: TLS_ECDHE_ECDSA_WITH_AES_256_CBC_SHA (0xc00a)
                Cipher Suite: TLS_ECDHE_RSA_WITH_AES_256_CBC_SHA (0xc014)
                Cipher Suite: TLS_RSA_WITH_AES_128_GCM_SHA256 (0x009c)
                Cipher Suite: TLS_RSA_WITH_AES_256_GCM_SHA384 (0x009d)
                Cipher Suite: TLS_RSA_WITH_AES_128_CBC_SHA (0x002f)
                Cipher Suite: TLS_RSA_WITH_AES_256_CBC_SHA (0x0035)
                Cipher Suite: TLS_RSA_WITH_3DES_EDE_CBC_SHA (0x000a)

                
                
                
                
                
                
                
                
                
                
                
                
                Compression Methods Length: 1
            Compression Methods (1 method)
                Compression Method: null (0)
            Extensions Length: 116
            Extension: extended_master_secret (len=0)
                Type: extended_master_secret (23)
                Length: 0
            Extension: renegotiation_info (len=1)
                Type: renegotiation_info (65281)
                Length: 1
                Renegotiation Info extension
                    Renegotiation info extension length: 0
            Extension: supported_groups (len=8)
                Type: supported_groups (10)
                Length: 8
                Supported Groups List Length: 6
                Supported Groups (3 groups)
                    Supported Group: x25519 (0x001d)
                    Supported Group: secp256r1 (0x0017)
                    Supported Group: secp384r1 (0x0018)
            Extension: ec_point_formats (len=2)
                Type: ec_point_formats (11)
                Length: 2
                EC point formats Length: 1
                Elliptic curves point formats (1)
                    EC point format: uncompressed (0)
            Extension: session_ticket (len=0)
                Type: session_ticket (35)
                Length: 0
                Data (0 bytes)
            Extension: signature_algorithms (len=20)
                Type: signature_algorithms (13)
                Length: 20
                Signature Hash Algorithms Length: 18
                Signature Hash Algorithms (9 algorithms)
                    Signature Algorithm: ecdsa_secp256r1_sha256 (0x0403)
                        Signature Hash Algorithm Hash: SHA256 (4)
                        Signature Hash Algorithm Signature: ECDSA (3)
                    Signature Algorithm: rsa_pss_rsae_sha256 (0x0804)
                        Signature Hash Algorithm Hash: Unknown (8)
                        Signature Hash Algorithm Signature: Unknown (4)
                    Signature Algorithm: rsa_pkcs1_sha256 (0x0401)
                        Signature Hash Algorithm Hash: SHA256 (4)
                        Signature Hash Algorithm Signature: RSA (1)
                    Signature Algorithm: ecdsa_secp384r1_sha384 (0x0503)
                        Signature Hash Algorithm Hash: SHA384 (5)
                        Signature Hash Algorithm Signature: ECDSA (3)
                    Signature Algorithm: rsa_pss_rsae_sha384 (0x0805)
                        Signature Hash Algorithm Hash: Unknown (8)
                        Signature Hash Algorithm Signature: Unknown (5)
                    Signature Algorithm: rsa_pkcs1_sha384 (0x0501)
                        Signature Hash Algorithm Hash: SHA384 (5)
                        Signature Hash Algorithm Signature: RSA (1)
                    Signature Algorithm: rsa_pss_rsae_sha512 (0x0806)
                        Signature Hash Algorithm Hash: Unknown (8)
                        Signature Hash Algorithm Signature: Unknown (6)
                    Signature Algorithm: rsa_pkcs1_sha512 (0x0601)
                        Signature Hash Algorithm Hash: SHA512 (6)
                        Signature Hash Algorithm Signature: RSA (1)
                    Signature Algorithm: rsa_pkcs1_sha1 (0x0201)
                        Signature Hash Algorithm Hash: SHA1 (2)
                        Signature Hash Algorithm Signature: RSA (1)
            Extension: key_share (len=38)
                Type: key_share (51)
                Length: 38
                Key Share extension
                    Client Key Share Length: 36
                    Key Share Entry: Group: x25519, Key Exchange length: 32
                        Group: x25519 (29)
                        Key Exchange Length: 32
                        Key Exchange: 808a3c7ea205a45f6d737fdcb332f1c0bb7d12503538a045…
            Extension: psk_key_exchange_modes (len=2)
                Type: psk_key_exchange_modes (45)
                Length: 2
                PSK Key Exchange Modes Length: 1
                PSK Key Exchange Mode: PSK with (EC)DHE key establishment (psk_dhe_ke) (1)
            Extension: supported_versions (len=9)
                Type: supported_versions (43)
                Length: 9
                Supported Versions length: 8
                Supported Version: TLS 1.3 (0x0304)
                Supported Version: TLS 1.2 (0x0303)
                Supported Version: TLS 1.1 (0x0302)
                Supported Version: TLS 1.0 (0x0301)
```

Looks like the difference is in `SNI` (`Extension: server_name`).
BoringSSL does support for SNI but does not advertise it in its command line tool.

The server is Cloudflare, looks like it requires SNI.

**Comment by alexey-milovidov** [comment]
https://stackoverflow.com/questions/5113333/how-to-implement-server-name-indication-sni

**Comment by alexey-milovidov** [comment]
Yes, the root cause is SNI.
Poco does not allow to resolve host in advance and use SNI.

**Comment by alexey-milovidov** [comment]
https://github.com/pocoproject/poco/issues/3123
