### ISSUE TITLE
Clickhouse swears on RST tcp flag from keepalived's health check

### ISSUE THREAD

**Issue by Vladikamira** [ClickHouse/ClickHouse#1851]
We have clickhouse cluster setup with version `1.1.54304`, there 4 nodes (2 shards with 2 replicas).
We want to balance requests to clickhouse TCP port by IPVS with keepalived and VRRP.
So, keepalived has TCP health check for clickhouse TCP port 9500:
```
  real_server 172.16.16.75 9500 {
    weight 10
    TCP_CHECK {
      connect_port 9500
      connect_timeout 3
    }
  }
```
We can see that every check session ends with `RST` flag:

```
   3424 2018-02-02 18:02:24.262839    172.16.16.253         172.16.16.75          TCP      74     51345 → 9500 [SYN] Seq=0 Win=42340 Len=0 MSS=1460 SACK_PERM=1 TSval=1289493860 TSecr=0 WS=4096

Frame 3424: 74 bytes on wire (592 bits), 74 bytes captured (592 bits)
Ethernet II, Src: SuperMic_2b:33:fa (00:25:90:2b:33:fa), Dst: SuperMic_84:6b:a6 (00:25:90:84:6b:a6)
Internet Protocol Version 4, Src: 172.16.16.253, Dst: 172.16.16.75
Transmission Control Protocol, Src Port: 51345, Dst Port: 9500, Seq: 0, Len: 0

   3425 2018-02-02 18:02:24.262858    172.16.16.75          172.16.16.253         TCP      74     9500 → 51345 [SYN, ACK] Seq=0 Ack=1 Win=28960 Len=0 MSS=1460 SACK_PERM=1 TSval=67372088 TSecr=1289493860 WS=128

Frame 3425: 74 bytes on wire (592 bits), 74 bytes captured (592 bits)
Ethernet II, Src: SuperMic_84:6b:a6 (00:25:90:84:6b:a6), Dst: SuperMic_2b:33:fa (00:25:90:2b:33:fa)
Internet Protocol Version 4, Src: 172.16.16.75, Dst: 172.16.16.253
Transmission Control Protocol, Src Port: 9500, Dst Port: 51345, Seq: 0, Ack: 1, Len: 0

   3426 2018-02-02 18:02:24.263635    172.16.16.253         172.16.16.75          TCP      66     51345 → 9500 [ACK] Seq=1 Ack=1 Win=45056 Len=0 TSval=1289493860 TSecr=67372088

Frame 3426: 66 bytes on wire (528 bits), 66 bytes captured (528 bits)
Ethernet II, Src: SuperMic_2b:33:fa (00:25:90:2b:33:fa), Dst: SuperMic_84:6b:a6 (00:25:90:84:6b:a6)
Internet Protocol Version 4, Src: 172.16.16.253, Dst: 172.16.16.75
Transmission Control Protocol, Src Port: 51345, Dst Port: 9500, Seq: 1, Ack: 1, Len: 0

   3427 2018-02-02 18:02:24.263659    172.16.16.253         172.16.16.75          TCP      66     51345 → 9500 [RST, ACK] Seq=1 Ack=1 Win=45056 Len=0 TSval=1289493860 TSecr=67372088

Frame 3427: 66 bytes on wire (528 bits), 66 bytes captured (528 bits)
Ethernet II, Src: SuperMic_2b:33:fa (00:25:90:2b:33:fa), Dst: SuperMic_84:6b:a6 (00:25:90:84:6b:a6)
Internet Protocol Version 4, Src: 172.16.16.253, Dst: 172.16.16.75
Transmission Control Protocol, Src Port: 51345, Dst Port: 9500, Seq: 1, Ack: 1, Len: 0
```
and clickhouse react on it with error in log:
```
2018.02.02 18:02:20.535984 [ 42 ] <Information> InterserverIOHTTPHandler: Done processing query
2018.02.02 18:02:24.263910 [ 53 ] <Error> ServerErrorHandler: Poco::Exception. Code: 1000, e.code() = 107, e.displayText() = Net Exception: Socket is not connected, e.what() = Net Exception
```
It's not affecting to clickhouse functions at all, just a lot of nosy errors logs (check every 5 seconds). I wondering, is it fine or not, because as I understand finish check session without any data transfer with RST it's normal, right?
Thanks in advance :)

**Comment by alexey-milovidov** [comment]
This is bug in Poco. We have fixed it long time ago.
But if you build ClickHouse by yourself, you may accidentially use Poco library from your system,
not the library bundled in ClickHouse. And it may still have this bug.

**Comment by alexey-milovidov** [comment]
09ebc85bb31963be1eeb4bba56d09a10a44d20d4
2758e1fe9212a9c06d1c9f9f954941b842507c28

**Comment by Vladikamira** [comment]
Upd
After upgrading to `1.1.54343` message still in log:
```
2018.03.05 19:38:06.835245 [ 1 ] <Information> : Starting daemon with revision 54343
2018.03.05 19:38:06.841801 [ 1 ] <Information> Application: starting up
...
2018.03.05 19:38:09.774213 [ 8 ] <Error> ServerErrorHandler: Poco::Exception. Code: 1000, e.code() = 107, e.displayText() = Net Exception: Socket is not connected, e.what() = Net Exception
2018.03.05 19:38:14.775811 [ 8 ] <Error> ServerErrorHandler: Poco::Exception. Code: 1000, e.code() = 107, e.displayText() = Net Exception: Socket is not connected, e.what() = Net Exception
```
we use `deb` package from repo `http://repo.yandex.ru/clickhouse/xenial/ stable` on Debian 9
No compilation of source code at all

**Comment by PhantomPhreak** [comment]
I have the same problem after making a TCP balancer using keepalived

**Comment by huangyaofu2** [comment]
i met this , there are 65 'CLOSE_WAIT' connections, i think this matters

**Comment by xiaods** [comment]
tcp health check is always trigger this error log.

**Comment by PhantomPhreak** [comment]
Still have this problem with ClickHouse v18.14.18

**Comment by liangliangxiao** [comment]
mark

**Comment by PhantomPhreak** [comment]
So, any activity here?

**Comment by alexey-milovidov** [comment]
Reproducing in master (20.4).
And we have a test for that: https://github.com/ClickHouse/ClickHouse/blob/master/src/Client/tests/test_connect.cpp

**Comment by alexey-milovidov** [comment]
Stack trace:

```
2020.04.15 06:46:02.620312 [ 16691 ] {} <Error> ServerErrorHandler: Poco::Exception. Code: 1000, e.code() = 107, e.displayText() = Net Exception: Socket is not connected, Stack trace (when copying this message, always include the lines below):

0. /home/milovidov/work/ClickHouse/build/../contrib/libcxx/include/exception:129: std::exception::capture() @ 0x15254438 in /home/milovidov/work/ClickHouse/build/programs/clickhouse
1. /home/milovidov/work/ClickHouse/build/../contrib/libcxx/include/exception:109: std::exception::exception() @ 0x15254405 in /home/milovidov/work/ClickHouse/build/programs/clickhouse
2. /home/milovidov/work/ClickHouse/build/../contrib/poco/Foundation/src/Exception.cpp:27: Poco::Exception::Exception(std::__1::basic_string<char, std::__1::char_traits<char>, std::__1::allocator<char> > const&, int) @ 0x2017dfd3 in /home/milovidov/work/ClickHouse/build/programs/clickhouse
3. /home/milovidov/work/ClickHouse/build/../contrib/poco/Foundation/src/Exception.cpp:141: Poco::RuntimeException::RuntimeException(std::__1::basic_string<char, std::__1::char_traits<char>, std::__1::allocator<char> > const&, int) @ 0x2018140d in /home/milovidov/work/ClickHouse/build/programs/clickhouse
4. /home/milovidov/work/ClickHouse/build/../contrib/poco/Foundation/src/Exception.cpp:160: Poco::IOException::IOException(std::__1::basic_string<char, std::__1::char_traits<char>, std::__1::allocator<char> > const&, int) @ 0x2018566d in /home/milovidov/work/ClickHouse/build/programs/clickhouse
5. /home/milovidov/work/ClickHouse/build/../contrib/poco/Net/src/NetException.cpp:26: Poco::Net::NetException::NetException(std::__1::basic_string<char, std::__1::char_traits<char>, std::__1::allocator<char> > const&, int) @ 0x200302bd in /home/milovidov/work/ClickHouse/build/programs/clickhouse
6. /home/milovidov/work/ClickHouse/build/../contrib/poco/Net/src/SocketImpl.cpp:1106: Poco::Net::SocketImpl::error(int, std::__1::basic_string<char, std::__1::char_traits<char>, std::__1::allocator<char> > const&) @ 0x20049460 in /home/milovidov/work/ClickHouse/build/programs/clickhouse
7. /home/milovidov/work/ClickHouse/build/../contrib/poco/Net/src/SocketImpl.cpp:1025: Poco::Net::SocketImpl::error() @ 0x20047efc in /home/milovidov/work/ClickHouse/build/programs/clickhouse
8. /home/milovidov/work/ClickHouse/build/../contrib/poco/Net/src/SocketImpl.cpp:0: Poco::Net::SocketImpl::peerAddress() @ 0x2004bc38 in /home/milovidov/work/ClickHouse/build/programs/clickhouse
9. /home/milovidov/work/ClickHouse/build/../contrib/poco/Net/include/Poco/Net/Socket.h:596: Poco::Net::Socket::peerAddress() const @ 0x152de39e in /home/milovidov/work/ClickHouse/build/programs/clickhouse
10. /home/milovidov/work/ClickHouse/build/../programs/server/TCPHandlerFactory.h:28: DB::TCPHandlerFactory::createConnection(Poco::Net::StreamSocket const&) @ 0x152de0a2 in /home/milovidov/work/ClickHouse/build/programs/clickhouse
11. /home/milovidov/work/ClickHouse/build/../contrib/poco/Net/src/TCPServerDispatcher.cpp:111: Poco::Net::TCPServerDispatcher::run() @ 0x200539c6 in /home/milovidov/work/ClickHouse/build/programs/clickhouse
12. /home/milovidov/work/ClickHouse/build/../contrib/poco/Foundation/src/ThreadPool.cpp:199: Poco::PooledThread::run() @ 0x20203243 in /home/milovidov/work/ClickHouse/build/programs/clickhouse
13. /home/milovidov/work/ClickHouse/build/../contrib/poco/Foundation/src/Thread.cpp:56: Poco::(anonymous namespace)::RunnableHolder::run() @ 0x201ffbbd in /home/milovidov/work/ClickHouse/build/programs/clickhouse
14. /home/milovidov/work/ClickHouse/build/../contrib/poco/Foundation/src/Thread_POSIX.cpp:345: Poco::ThreadImpl::runnableEntry(void*) @ 0x201fea48 in /home/milovidov/work/ClickHouse/build/programs/clickhouse
15. start_thread @ 0x9669 in /usr/lib/x86_64-linux-gnu/libpthread-2.30.so
16. clone @ 0x122323 in /usr/lib/x86_64-linux-gnu/libc-2.30.so
 (version 20.4.1.1)
```

**Comment by filimonov** [comment]
Related to https://github.com/ClickHouse/ClickHouse/issues/23858
