### ISSUE TITLE
clickhouse insert  no response

### ISSUE THREAD

**Issue by sgyt1993** [ClickHouse/ClickHouse#34594]
![image](https://user-images.githubusercontent.com/43462613/153985073-941b0ea6-a65e-4ecc-a7b8-fe2b980acb2e.png)
when clickhouse insert 5W data, Often happen

springboot log:
Cause: ru.yandex.clickhouse.except.ClickHouseException: ClickHouse exception, code: 210, host: 172.16.102.29, port: 8123; Connect to 172.16.102.29:8123 [/172.16.102.29] failed: Connection refused (Connection refused)

clickhouse log:
2022.02.15 10:32:21.765673 [ 27320 ] {} <Trace> system.query_log (dc5bc03c-3c9d-428d-b5f9-f04c84a93fdb): Renaming temporary part tmp_merge_202202_181919_202646_7094 to 202202_181919_202646_7094.
2022.02.15 10:32:21.765813 [ 27320 ] {} <Trace> system.query_log (dc5bc03c-3c9d-428d-b5f9-f04c84a93fdb) (MergerMutator): Merged 2 parts: from 202202_181919_202645_7093 to 202202_202646_202646_0
2022.02.15 10:32:21.765842 [ 27320 ] {} <Debug> MemoryTracker: Peak memory usage: 94.06 MiB.
2022.02.15 10:32:22.518573 [ 27364 ] {} <Trace> HTTPHandler-factory: HTTP Request for HTTPHandler-factory. Method: GET, Address: 172.16.102.18:37088, User-Agent: Java/1.8.0_221, Content Type: , Transfer Encoding: identity
2022.02.15 10:32:23.935035 [ 27344 ] {} <Debug> train_plane.train_ticket (SelectExecutor): Key condition: unknown
2022.02.15 10:32:23.935148 [ 27344 ] {} <Debug> train_plane.train_ticket (SelectExecutor): MinMax index condition: unknown
2022.02.15 10:32:23.935245 [ 27344 ] {} <Trace> train_plane.train_ticket (SelectExecutor): Not using primary index on part 202110_3238679_65830215_8165_65860501
2022.02.15 10:32:23.935285 [ 27344 ] {} <Debug> train_plane.train_ticket (SelectExecutor): Selected 1 parts by date, 1 parts by key, 2842 marks by primary key, 2842 marks to read from 1 ranges
2022.02.15 10:32:23.935349 [ 27344 ] {} <Trace> MergeTreeSelectProcessor: Reading 1 ranges from part 202110_3238679_65830215_8165_65860501, approx. 22106253 rows starting from 0
2022.02.15 10:32:23.935433 [ 27344 ] {} <Trace> InterpreterSelectQuery: FetchColumns -> Complete

tcpdump log
15:50:30.659755 IP wht-cyjgdb.34720 > 172.16.102.29.8123: Flags [S], seq 657444348, win 29200, options [mss 1460,sackOK,TS val 3095809138 ecr 0,nop,wscale 7], length 0
15:50:30.660381 IP 172.16.102.29.8123 > wht-cyjgdb.34720: Flags [R.], seq 0, ack 657444349, win 0, length 0
15:50:30.663595 IP wht-cyjgdb.34722 > 172.16.102.29.8123: Flags [S], seq 2354752417, win 29200, options [mss 1460,sackOK,TS val 3095809142 ecr 0,nop,wscale 7], length 0
15:50:30.663852 IP 172.16.102.29.8123 > wht-cyjgdb.34722: Flags [R.], seq 0, ack 2354752418, win 0, length 0
15:50:30.914677 IP wht-cyjgdb.34724 > 172.16.102.29.8123: Flags [S], seq 3022905716, win 29200, options [mss 1460,sackOK,TS val 3095809393 ecr 0,nop,wscale 7], length 0
15:50:30.915005 IP 172.16.102.29.8123 > wht-cyjgdb.34724: Flags [R.], seq 0, ack 3022905717, win 0, length 0
15:50:31.291534 IP wht-cyjgdb.34726 > 172.16.102.29.8123: Flags [S], seq 1964384867, win 29200, options [mss 1460,sackOK,TS val 3095809770 ecr 0,nop,wscale 7], length 0
15:50:31.291952 IP 172.16.102.29.8123 > wht-cyjgdb.34726: Flags [R.], seq 0, ack 1964384868, win 0, length 0
15:50:31.854836 IP wht-cyjgdb.34728 > 172.16.102.29.8123: Flags [S], seq 935255771, win 29200, options [mss 1460,sackOK,TS val 3095810334 ecr 0,nop,wscale 7], length 0
15:50:31.855204 IP 172.16.102.29.8123 > wht-cyjgdb.34728: Flags [R.], seq 0, ack 935255772, win 0, length 0
15:50:32.699261 IP wht-cyjgdb.34730 > 172.16.102.29.8123: Flags [S], seq 3309271449, win 29200, options [mss 1460,sackOK,TS val 3095811178 ecr 0,nop,wscale 7], length 0
15:50:32.699588 IP 172.16.102.29.8123 > wht-cyjgdb.34730: Flags [R.], seq 0, ack 3309271450, win 0, length 0
15:50:33.904791 IP wht-cyjgdb.34732 > 172.16.102.29.8123: Flags [S], seq 1853582819, win 29200, options [mss 1460,sackOK,TS val 3095812383 ecr 0,nop,wscale 7], length 0
15:50:33.905108 IP 172.16.102.29.8123 > wht-cyjgdb.34732: Flags [R.], seq 0, ack 1853582820, win 0, length 0
15:50:33.905485 IP wht-cyjgdb.34734 > 172.16.102.29.8123: Flags [S], seq 2874707000, win 29200, options [mss 1460,sackOK,TS val 3095812384 ecr 0,nop,wscale 7], length 0
15:50:33.905756 IP 172.16.102.29.8123 > wht-cyjgdb.34734: Flags [R.], seq 0, ack 2874707001, win 0, length 0
15:50:33.906269 IP wht-cyjgdb.34736 > 172.16.102.29.8123: Flags [S], seq 4131696962, win 29200, options [mss 1460,sackOK,TS val 3095812385 ecr 0,nop,wscale 7], length 0
15:50:33.906524 IP 172.16.102.29.8123 > wht-cyjgdb.34736: Flags [R.], seq 0, ack 4131696963, win 0, length 0
15:50:33.906817 IP wht-cyjgdb.34738 > 172.16.102.29.8123: Flags [S], seq 1447734277, win 29200, options [mss 1460,sackOK,TS val 3095812386 ecr 0,nop,wscale 7], length 0
15:50:33.907026 IP 172.16.102.29.8123 > wht-cyjgdb.34738: Flags [R.], seq 0, ack 1447734278, win 0, length 0
15:50:33.907287 IP wht-cyjgdb.34740 > 172.16.102.29.8123: Flags [S], seq 520609604, win 29200, options [mss 1460,sackOK,TS val 3095812386 ecr 0,nop,wscale 7], length 0
15:50:33.907539 IP 172.16.102.29.8123 > wht-cyjgdb.34740: Flags [R.], seq 0, ack 520609605, win 0, length 0
15:50:33.908123 IP wht-cyjgdb.34742 > 172.16.102.29.8123: Flags [S], seq 443206405, win 29200, options [mss 1460,sackOK,TS val 3095812387 ecr 0,nop,wscale 7], length 0
15:50:33.908334 IP 172.16.102.29.8123 > wht-cyjgdb.34742: Flags [R.], seq 0, ack 443206406, win 0, length 0
15:50:33.908643 IP wht-cyjgdb.34744 > 172.16.102.29.8123: Flags [S], seq 1703772425, win 29200, options [mss 1460,sackOK,TS val 3095812387 ecr 0,nop,wscale 7], length 0
15:50:33.908865 IP 172.16.102.29.8123 > wht-cyjgdb.34744: Flags [R.], seq 0, ack 1703772426, win 0, length 0
15:50:33.909170 IP wht-cyjgdb.34746 > 172.16.102.29.8123: Flags [S], seq 3606421542, win 29200, options [mss 1460,sackOK,TS val 3095812388 ecr 0,nop,wscale 7], length 0
15:50:33.909377 IP 172.16.102.29.8123 > wht-cyjgdb.34746: Flags [R.], seq 0, ack 3606421543, win 0, length 0
15:50:33.964428 IP wht-cyjgdb.34748 > 172.16.102.29.8123: Flags [S], seq 486086398, win 29200, options [mss 1460,sackOK,TS val 3095812443 ecr 0,nop,wscale 7], length 0
15:50:33.964712 IP 172.16.102.29.8123 > wht-cyjgdb.34748: Flags [R.], seq 0, ack 486086399, win 0, length 0
15:50:35.861573 IP wht-cyjgdb.34750 > 172.16.102.29.8123: Flags [S], seq 2335620715, win 29200, options [mss 1460,sackOK,TS val 3095814340 ecr 0,nop,wscale 7], length 0
15:50:35.862177 IP 172.16.102.29.8123 > wht-cyjgdb.34750: Flags [R.], seq 0, ack 2335620716, win 0, length 0
15:50:38.707210 IP wht-cyjgdb.34752 > 172.16.102.29.8123: Flags [S], seq 3599332236, win 29200, options [mss 1460,sackOK,TS val 3095817186 ecr 0,nop,wscale 7], length 0
15:50:38.707804 IP 172.16.102.29.8123 > wht-cyjgdb.34752: Flags [R.], seq 0, ack 3599332237, win 0, length 0
15:50:42.974734 IP wht-cyjgdb.34754 > 172.16.102.29.8123: Flags [S], seq 1519754569, win 29200, options [mss 1460,sackOK,TS val 3095821453 ecr 0,nop,wscale 7], length 0
15:50:42.975466 IP 172.16.102.29.8123 > wht-cyjgdb.34754: Flags [R.], seq 0, ack 1519754570, win 0, length 0
15:50:49.375581 IP wht-cyjgdb.34758 > 172.16.102.29.8123: Flags [S], seq 2425874332, win 29200, options [mss 1460,sackOK,TS val 3095827854 ecr 0,nop,wscale 7], length 0
15:50:49.376216 IP 172.16.102.29.8123 > wht-cyjgdb.34758: Flags [R.], seq 0, ack 2425874333, win 0, length 0
15:50:58.975140 IP wht-cyjgdb.34762 > 172.16.102.29.8123: Flags [S], seq 3889644278, win 29200, options [mss 1460,sackOK,TS val 3095837454 ecr 0,nop,wscale 7], length 0

I don't know why clickhouse seq = 0  and  clickhouse log haven't insert log or post request
wish know how to slove this question

**Comment by yonoel** [comment]
I have the same question as you.it occurs while connecting to clickhouse server,but it's not always.

**Comment by baxitashraf** [comment]
In this case you can check logs from "/var/log/clickhouse-server/clickhouse-server.err.log", CH will not allow you to connect to the database while loading the content of Egine:Memory table in the memory.
