### ISSUE TITLE
User_dn_detection does not work for multirole mapping in AD

### ISSUE THREAD

**Issue by Fritzss** [ClickHouse/ClickHouse#39086]
My test stand
```
SELECT version()
┌─version()─┐
│ 22.6.2.12 │
└───────────┘
```

Active Directory LDS: company.com
User_DN CN=test,OU=users,DC=company,DC=com

Role mapping group
```
│ CREATE ROLE chadmins │
│ CREATE ROLE chdev │
│ CREATE ROLE chintegration │
│ CREATE ROLE chprod │
```

MS AD Groups
```
 CN=chadmin,OU=Clickhouse Access Groups,OU=Groups,DC=company,DC=com
 CN=chdev,OU=Clickhouse Access Groups,OU=Groups,DC=company,DC=com
 CN=chintegration,OU=Clickhouse Access Groups,OU=Groups,DC=company,DC=com
 CN=chprod,OU=Clickhouse Access Groups,OU=Groups,DC=company,DC=com
```

LDAP config:
ldap
```
<?xml version="1.0" encoding="utf-8"?>
<clickhouse>
  <ldap_servers>
    <test>
       <host>dc.company.com</host>
       <port>389</port>
       <enable_tls>no</enable_tls>
       <scope>subtree</scope>
       <verification_cooldown>300</verification_cooldown>
       <bind_dn>{user_name}@company.com</bind_dn>
       <user_dn_detection>
             <base_dn>OU=Users,DC=company,DC=com</base_dn>
             <search_filter>(&amp;(objectClass=user)(anr={user_name}))</search_filter>
             <scope>Subtree</scope>
       </user_dn_detection>
    </test>
  </ldap_servers>
</clickhouse>
```
Users
```
<?xml version="1.0" encoding="utf-8"?>
<clickhouse>
    <user_directories>
        <ldap>
            <server>test</server>
            <roles>
                <chadmins/>
                <chprod/>
                <chintegration/>
                <chdev/>
            </roles>
            <role_mapping>
                <base_dn>OU=Clickhouse Access Groups,OU=Groups,DC=company,DC=com</base_dn>
                <scope>base</scope>
                <search_filter>(&amp;(objectClass=groupOfUniqueNames)(uniqueMember={bind_dn}))</search_filter>
                <attribute>cn</attribute>
            </role_mapping>
        </ldap>
    </user_directories>
</clickhouse>
```

**Problem**
User login but mapped to all groups
```
(Get-ADUser -identity test -Properties memberOf).MemberOf
CN=chdev,OU=Clickhouse Access Groups,OU=Groups,DC=company,DC=com
```
```
SHOW GRANTS
GRANT chadmins, chdev, chintegration, chprod TO test
```
```
clickhouse-client -q "SHOW ACCESS"
CREATE USER default IDENTIFIED WITH plaintext_password SETTINGS PROFILE default
CREATE USER test IDENTIFIED WITH ldap SERVER \'test\'
CREATE ROLE chadmins
CREATE ROLE chdev
CREATE ROLE chintegration
CREATE ROLE chprod
CREATE SETTINGS PROFILE default SETTINGS load_balancing = \'random\'
CREATE SETTINGS PROFILE readonly SETTINGS readonly = 1
CREATE QUOTA default KEYED BY user_name FOR INTERVAL 1 hour TRACKING ONLY TO default
GRANT ALL ON *.* TO default WITH GRANT OPTION
GRANT chadmins, chdev, chintegration, chprod TO test
GRANT ALL ON *.* TO chadmins
GRANT SELECT ON testdb.test_table TO chdev
GRANT SELECT ON testdb.integration_table TO chintegration
GRANT SELECT ON testdb.test_table TO chintegration
GRANT SELECT ON testdb.* TO chprod
```

**Comment by Fritzss** [comment]
queury clickhouse
14:45:49.950686 IP 172.21.24.55.45198 > 172.21.111.11.389: Flags [P.], seq 149:312, ack 126, win 502, options [nop,nop,TS val 758198394 ecr 1822285269], len
        0x0000:  4500 00d7 ecce 4000 4006 6de5 ac15 1837  E.....@.@.m....7
        0x0010:  ac15 6f0b b08e 0185 4ad3 80d2 e0de 9b6b  ..o.....J......k
        0x0020:  8018 01f6 e036 0000 0101 080a 2d31 307a  .....6......-10z
        0x0030:  6c9d ddd5 3081 a002 0103 6381 9a04 244f  l...0.....c...$O
        0x0040:  553d 4772 6f75 7073 2c4f 553d 556e 6974  U=Groups,OU=Unit
        0x0050:  732c 4443 3d67 6f69 6e74 7261 2c44 433d  s,DC=gointra,DC=
        0x0060:  6e65 740a 0100 0a01 0002 0164 0201 1401  com........d....
        0x0070:  0100 a95d 8117 312e 322e 3834 302e 3131  ...]..1.2.840.11
        0x0080:  3335 3536 2e31 2e34 2e31 3934 3182 066d  3556.1.4.1941..m
        0x0090:  656d 6265 7283 3a43 4e3d 7465 7374 2075  ember.:CN=test.u
        0x00a0:  7365 722c 4f55 3d41 646d 696e 732c 4f55  ser,OU=Admins,OU
        0x00b0:  3d55 7365 7273 2c4f 553d 556e 6974 732c  =Users,OU=Units,
        0x00c0:  4443 3d67 6f69 6e74 7261 2c44 433d 6e65  DC=gointra,DC=ne
        0x00d0:  7430 0404 0263 6e                        t0...cn
queury ldapsearch
14:47:19.802728 IP 172.21.24.55.45200 > 172.21.111.11.389: Flags [P.], seq 43:202, ack 23, win 502, options [nop,nop,TS val 758288246 ecr 1822375117], length 159
        0x0000:  4500 00d3 b891 4000 4006 a226 ac15 1837  E.....@.@..&...7
        0x0010:  ac15 6f0b b090 0185 bda4 f47f 5fcb da01  ..o........._...
        0x0020:  8018 01f6 e032 0000 0101 080a 2d32 8f76  .....2......-2.v
        0x0030:  6c9f 3ccd 3081 9c02 0102 6381 9604 244f  l.<.0.....c...$O
        0x0040:  553d 4772 6f75 7073 2c4f 553d 556e 6974  U=Groups,OU=Unit
        0x0050:  732c 4443 3d67 6f69 6e74 7261 2c44 433d  s,DC=gointra,DC=
        0x0060:  6e65 740a 0102 0a01 0002 0100 0201 0001  com.............
        0x0070:  0100 a95d 8117 312e 322e 3834 302e 3131  ...]..1.2.840.11
        0x0080:  3335 3536 2e31 2e34 2e31 3934 3182 066d  3556.1.4.1941..m
        0x0090:  656d 6265 7283 3a43 4e3d 7465 7374 2075  ember.:CN=test.u
        0x00a0:  7365 722c 4f55 3d41 646d 696e 732c 4f55  ser,OU=Admins,OU
        0x00b0:  3d55 7365 7273 2c4f 553d 556e 6974 732c  =Users,OU=Units,
        0x00c0:  4443 3d67 6f69 6e74 7261 2c44 433d 6e65  DC=gointra,DC=ne
        0x00d0:  7430 00                                  t0.

**Comment by Fritzss** [comment]
```
request clickhouse
    clickhouse.45646 > dc.company.net.389: Flags [P.], cksum 0xe057 (incorrect -> 0xb006), seq 149:345, ack 126, win 502, options [nop,nop,TS val 822821312 er 1886907458], length 196
        0x0000:  0004 0001 0006 0050 5693 c3ec 0000 0800  .......PV.......
        0x0010:  4500 00f8 103b 4000 4006 4a58 ac15 1837  E....;@.@.JX...7
        0x0020:  ac15 6f0b b24e 0185 5504 a1c4 ab49 1351  ..o..N..U....I.Q
        0x0030:  8018 01f6 e057 0000 0101 080a 310b 41c0  .....W......1.A.
        0x0040:  7077 ec42 3081 c102 0103 6381 bb04 454f  pw.B0.....c...EO
        0x0050:  553d 6465 762c 4f55 3d43 6c69 636b 686f  U=dev,OU=Clickho
        0x0060:  7573 6541 6363 6573 7347 726f 7570 732c  useAccessGroups,
        0x0070:  4f55 3d47 726f 7570 732c 4f55 3d55 6e69  OU=Groups,OU=Uni
        0x0080:  7473 2c44 433d 676f 696e 7472 612c 4443  ts,DC=company,DC
        0x0090:  3d6e 6574 0a01 020a 0100 0201 6402 0114  =com........d...
        0x00a0:  0101 00a0 51a9 3681 1731 2e32 2e38 3430  ....Q.6..1.2.840
        0x00b0:  2e31 3133 3535 362e 312e 342e 3139 3431  .113556.1.4.1941
        0x00c0:  8206 6d65 6d62 6572 8313 676f 5f74 6573  ..member..tes
        0x00d0:  7440 676f 696e 7472 612e 6e65 74a3 1704  t@company.com...
        0x00e0:  0e6f 626a 6563 7443 6174 6567 6f72 7904  .objectCategory.
        0x00f0:  0567 726f 7570 3010 040e 7341 4d41 6363  .group0...sAMAcc
        0x0100:  6f75 6e74 4e61 6d65                      ountName
responce DC
08:42:52.869483 IP (tos 0x0, ttl 127, id 42324, offset 0, flags [DF], proto TCP (6), length 74)
    dc.company.net.389 > clickhouse.45646: Flags [P.], cksum 0x73a9 (correct), seq 126:148, ack 345, win 8194, options [nop,nop,TS val 1886907459 ecr 82282132], length 22
        0x0000:  0000 0001 0006 00de fb1d ddc2 0000 0800  ................
        0x0010:  4500 004a a554 4000 7f06 76ec ac15 6f0b  E..J.T@...v...o.
        0x0020:  ac15 1837 0185 b24e ab49 1351 5504 a288  ...7...N.I.QU...
        0x0030:  8018 2002 73a9 0000 0101 080a 7077 ec43  ....s.......pw.C
        0x0040:  310b 41c0 3084 0000 0010 0201 0365 8400  1.A.0........e..
        0x0050:  0000 070a 0100 0400 0400                 ..........

```

**Comment by Fritzss** [comment]
```
request clickhouse
    clickhouse.45646 > dc.company.com.389: Flags [P.], cksum 0xe057 (incorrect -> 0xb006), seq 149:345, ack 126, win 502, options [nop,nop,TS val 822821312 er 1886907458], length 196
        0x0000:  0004 0001 0006 0050 5693 c3ec 0000 0800  .......PV.......
        0x0010:  4500 00f8 103b 4000 4006 4a58 ac15 1837  E....;@.@.JX...7
        0x0020:  ac15 6f0b b24e 0185 5504 a1c4 ab49 1351  ..o..N..U....I.Q
        0x0030:  8018 01f6 e057 0000 0101 080a 310b 41c0  .....W......1.A.
        0x0040:  7077 ec42 3081 c102 0103 6381 bb04 454f  pw.B0.....c...EO
        0x0050:  553d 6465 762c 4f55 3d43 6c69 636b 686f  U=dev,OU=Clickho
        0x0060:  7573 6541 6363 6573 7347 726f 7570 732c  useAccessGroups,
        0x0070:  4f55 3d47 726f 7570 732c 4f55 3d55 6e69  OU=Groups,OU=Uni
        0x0080:  7473 2c44 433d 676f 696e 7472 612c 4443  ts,DC=company,DC
        0x0090:  3d6e 6574 0a01 020a 0100 0201 6402 0114  =com........d...
        0x00a0:  0101 00a0 51a9 3681 1731 2e32 2e38 3430  ....Q.6..1.2.840
        0x00b0:  2e31 3133 3535 362e 312e 342e 3139 3431  .113556.1.4.1941
        0x00c0:  8206 6d65 6d62 6572 8313 676f 5f74 6573  ..member..tes
        0x00d0:  7440 676f 696e 7472 612e 6e65 74a3 1704  t@company.com...
        0x00e0:  0e6f 626a 6563 7443 6174 6567 6f72 7904  .objectCategory.
        0x00f0:  0567 726f 7570 3010 040e 7341 4d41 6363  .group0...sAMAcc
        0x0100:  6f75 6e74 4e61 6d65                      ountName
responce DC
08:42:52.869483 IP (tos 0x0, ttl 127, id 42324, offset 0, flags [DF], proto TCP (6), length 74)
    dc.company.com.389 > clickhouse.45646: Flags [P.], cksum 0x73a9 (correct), seq 126:148, ack 345, win 8194, options [nop,nop,TS val 1886907459 ecr 82282132], length 22
        0x0000:  0000 0001 0006 00de fb1d ddc2 0000 0800  ................
        0x0010:  4500 004a a554 4000 7f06 76ec ac15 6f0b  E..J.T@...v...o.
        0x0020:  ac15 1837 0185 b24e ab49 1351 5504 a288  ...7...N.I.QU...
        0x0030:  8018 2002 73a9 0000 0101 080a 7077 ec43  ....s.......pw.C
        0x0040:  310b 41c0 3084 0000 0010 0201 0365 8400  1.A.0........e..
        0x0050:  0000 070a 0100 0400 0400                 ..........

ldapsearch -v -x -D "test@company.com" -w "password" -b "OU=ClickhouseAccessGroups,OU=Groups,OU=Units,DC=company,DC=com" -H "ldap://dc.company.com" "(&(objectClass=group)(member:1.2.840.113556.1.4.1941:=CN=test user,OU=Admins,OU=Users,OU=Units,DC=company,DC=com))"
ldap_initialize( ldap://dc.company.com:389/??base )
filter: (&(objectClass=group)(member:1.2.840.113556.1.4.1941:=CN=test user,OU=Admins,OU=Users,OU=Units,DC=company,DC=com))
requesting: All userApplication attributes
# extended LDIF
#
# LDAPv3
# base <OU=ClickhouseAccessGroups,OU=Groups,OU=Units,DC=company,DC=com> with scope subtree
# filter: (&(objectClass=group)(member:1.2.840.113556.1.4.1941:=CN=test user,OU=Admins,OU=Users,OU=Units,DC=company,DC=com))
# requesting: ALL
#

# ch_dev, dev, ClickhouseAccessGroups, Groups, Units, company.com
dn: CN=ch_dev,OU=dev,OU=ClickhouseAccessGroups,OU=Groups,OU=Units,DC=company,DC=com
objectClass: top
objectClass: group
cn: ch_dev
member: CN=test user,OU=Admins,OU=Users,OU=Units,DC=company,DC=com
distinguishedName: CN=ch_dev,OU=dev,OU=ClickhouseAccessGroups,OU=Groups,OU=Units,DC=company,DC=com
sAMAccountName: ch_dev
objectCategory: CN=Group,CN=Schema,CN=Configuration,DC=company,DC=com
# search result
search: 2
result: 0 Success
```
