### ISSUE TITLE
MongoDB engine should support `authSource=` option

### ISSUE THREAD

**Issue by juvenn** [ClickHouse/ClickHouse#32594]
In lots of MongoDB deployments, an `admin` database is used for provision users and grants, a client is expected to specify authSource in the uri to connect. E.g.
```
mongodb:27017/test?authSource=admin
```

By mongo client, it is specified like this,
```
mongo -u test -p pass --authenticationDatabase=admin mongodb:27017/test
```

Yet, currently the MongoDB engine dose not support the option. Which results in it can only connect to a database, where the user resides in.

### How to reproduce

It can be reproduced by `clickhouse/clickhouse-server:21.10.2` docker image.

In mongo shell, create user and database

```javascript
use admin;
db.createUser(
  {
    user: "test",
    pwd: "pass",
    roles: [ { role: "userAdminAnyDatabase", db: "admin" }, "readWriteAnyDatabase" ]
  }
)

use test;
db.movies.insertMany([    {       title: 'Titanic',       year: 1997,       genres: [ 'Drama', 'Romance' ],       rated: 'PG-13',       languages: [ 'English', 'French', 'German', 'Swedish', 'Italian', 'Russian' ],       released: ISODate("1997-12-19T00:00:00.000Z"),       awards: {          wins: 127,          nominations: 63,          text: 'Won 11 Oscars. Another 116 wins & 63 nominations.'       },       cast: [ 'Leonardo DiCaprio', 'Kate Winslet', 'Billy Zane', 'Kathy Bates' ],       directors: [ 'James Cameron' ]    },    {       title: 'The Dark Knight',       year: 2008,       genres: [ 'Action', 'Crime', 'Drama' ],       rated: 'PG-13',       languages: [ 'English', 'Mandarin' ],       released: ISODate("2008-07-18T00:00:00.000Z"),       awards: {          wins: 144,          nominations: 106,          text: 'Won 2 Oscars. Another 142 wins & 106 nominations.'       },       cast: [ 'Christian Bale', 'Heath Ledger', 'Aaron Eckhart', 'Michael Caine' ],       directors: [ 'Christopher Nolan' ]    },    {       title: 'Spirited Away',       year: 2001,       genres: [ 'Animation', 'Adventure', 'Family' ],       rated: 'PG',       languages: [ 'Japanese' ],       released: ISODate("2003-03-28T00:00:00.000Z"),       awards: {          wins: 52,          nominations: 22,          text: 'Won 1 Oscar. Another 51 wins & 22 nominations.'       },       cast: [ 'Rumi Hiiragi', 'Miyu Irino', 'Mari Natsuki', 'Takashi Naitè' ],       directors: [ 'Hayao Miyazaki' ]    },    {       title: 'Casablanca',       genres: [ 'Drama', 'Romance', 'War' ],       rated: 'PG',       cast: [ 'Humphrey Bogart', 'Ingrid Bergman', 'Paul Henreid', 'Claude Rains' ],       languages: [ 'English', 'French', 'German', 'Italian' ],       released: ISODate("1943-01-23T00:00:00.000Z"),       directors: [ 'Michael Curtiz' ],       awards: {          wins: 9,          nominations: 6,          text: 'Won 3 Oscars. Another 6 wins & 6 nominations.'       },       lastupdated: '2015-09-04 00:22:54.600000000',       year: 1942    } ])

```

In clickhouse,
```
create database test;
CREATE TABLE Movies
(
  _id String,
  title String,
  year String,
  rated String
) ENGINE = MongoDB("mongodb:27017", "test", "movies", "test", "pass", "authSource=admin");
SELECT * FROM Movies LIMIT 1;
// DB::Exception: Cannot authenticate in MongoDB, incorrect user or password. (MONGODB_CANNOT_AUTHENTICATE)
```

**Comment by juvenn** [comment]
With tcpdump we can see the differences.

A clickhouse connection (Notice, there is `$db....admin`):
```
04:30:48.833267 IP 17a5c3a168fe.59854 > lean_mongodb_1.lean_default.27017: Flags [P.], seq 318:477, ack 267, win 501, options [nop,nop,TS val 2238347537 ecr 4172217444], length 159
	0x0000:  4500 00d3 bde8 4000 4006 2408 ac12 0007  E.....@.@.$.....
	0x0010:  ac12 0009 e9ce 6989 66e9 97a3 3796 5f40  ......i.f...7._@
	0x0020:  8018 01f5 58fa 0000 0101 080a 856a 7911  ....X........jy.
	0x0030:  f8ae fc64 9f00 0000 0000 0000 0000 0000  ...d............
	0x0040:  d407 0000 0000 0000 7465 7374 2e24 636d  ........test.$cm
	0x0050:  6400 0000 0000 0100 0000 7900 0000 1073  d.........y....s
	0x0060:  6173 6c53 7461 7274 0001 0000 0002 6d65  aslStart......me
	0x0070:  6368 616e 6973 6d00 0c00 0000 5343 5241  chanism.....SCRA
	0x0080:  4d2d 5348 412d 3100 0570 6179 6c6f 6164  M-SHA-1..payload
	0x0090:  002c 0000 0000 6e2c 2c6e 3d74 6573 742c  .,....n,,n=test,
	0x00a0:  723d 3137 3565 6634 3265 6635 3163 6533  r=175ef42ef51ce3
	0x00b0:  3865 3263 6263 3239 6639 3339 6565 6238  8e2cbc29f939eeb8
	0x00c0:  3533 0861 7574 6841 7574 686f 7269 7a65  53.authAuthorize
	0x00d0:  0001 00                                  ...
04:30:48.834841 IP lean_mongodb_1.lean_default.27017 > 17a5c3a168fe.59854: Flags [P.], seq 267:400, ack 477, win 505, options [nop,nop,TS val 4172750727 ecr 2238347537], length 133
	0x0000:  4500 00b9 a9f9 4000 4006 3811 ac12 0009  E.....@.@.8.....
	0x0010:  ac12 0007 6989 e9ce 3796 5f40 66e9 9842  ....i...7._@f..B
	0x0020:  8018 01f9 58e0 0000 0101 080a f8b7 1f87  ....X...........
	0x0030:  856a 7911 8500 0000 0401 0000 0000 0000  .jy.............
	0x0040:  0100 0000 0800 0000 0000 0000 0000 0000  ................
	0x0050:  0000 0000 0100 0000 6100 0000 016f 6b00  ........a....ok.
	0x0060:  0000 0000 0000 0000 0265 7272 6d73 6700  .........errmsg.
	0x0070:  1700 0000 4175 7468 656e 7469 6361 7469  ....Authenticati
	0x0080:  6f6e 2066 6169 6c65 642e 0010 636f 6465  on.failed...code
	0x0090:  0012 0000 0002 636f 6465 4e61 6d65 0015  ......codeName..
	0x00a0:  0000 0041 7574 6865 6e74 6963 6174 696f  ...Authenticatio
	0x00b0:  6e46 6169 6c65 6400 00                   nFailed..
```

And a successful mongo command connection:
```
04:27:17.973040 IP 17a5c3a168fe.43624 > lean_mongodb_1.lean_default.27017: Flags [P.], seq 478:619, ack 1815, win 501, options [nop,nop,TS val 2238136428 ecr 4172539616], length 141
	0x0000:  4500 00c1 5a58 4000 4006 87aa ac12 0007  E...ZX@.@.......
	0x0010:  ac12 0009 aa68 6989 bfc6 3908 5a18 9df1  .....hi...9.Z...
	0x0020:  8018 01f5 58e8 0000 0101 080a 8567 406c  ....X........g@l
	0x0030:  f8b3 e6e0 8d00 0000 0400 0000 0000 0000  ................
	0x0040:  dd07 0000 0000 0000 0078 0000 0010 7361  .........x....sa
	0x0050:  736c 5374 6172 7400 0100 0000 026d 6563  slStart......mec
	0x0060:  6861 6e69 736d 000c 0000 0053 4352 414d  hanism.....SCRAM
	0x0070:  2d53 4841 2d31 0005 7061 796c 6f61 6400  -SHA-1..payload.
	0x0080:  2c00 0000 006e 2c2c 6e3d 7465 7374 2c72  ,....n,,n=test,r
	0x0090:  3d41 6c58 4c6a 4d6f 2f45 664d 4375 4f7a  =AlXLjMo/EfMCuOz
	0x00a0:  696f 3070 4344 6b66 346c 6277 4f50 4a2b  io0pCDkf4lbwOPJ+
	0x00b0:  7802 2464 6200 0600 0000 6164 6d69 6e00  x.$db.....admin.
	0x00c0:  00                                       .
04:27:17.975065 IP lean_mongodb_1.lean_default.27017 > 17a5c3a168fe.43624: Flags [P.], seq 1815:1995, ack 619, win 506, options [nop,nop,TS val 4172539619 ecr 2238136428], length 180
	0x0000:  4500 00e8 63d2 4000 4006 7e09 ac12 0009  E...c.@.@.~.....
	0x0010:  ac12 0007 6989 aa68 5a18 9df1 bfc6 3995  ....i..hZ.....9.
	0x0020:  8018 01fa 590f 0000 0101 080a f8b3 e6e3  ....Y...........
	0x0030:  8567 406c b400 0000 f900 0000 0400 0000  .g@l............
	0x0040:  dd07 0000 0000 0000 009f 0000 0010 636f  ..............co
	0x0050:  6e76 6572 7361 7469 6f6e 4964 0001 0000  nversationId....
	0x0060:  0008 646f 6e65 0000 0570 6179 6c6f 6164  ..done...payload
	0x0070:  0065 0000 0000 723d 416c 584c 6a4d 6f2f  .e....r=AlXLjMo/
	0x0080:  4566 4d43 754f 7a69 6f30 7043 446b 6634  EfMCuOzio0pCDkf4
	0x0090:  6c62 774f 504a 2b78 5a45 6e4d 4c35 6171  lbwOPJ+xZEnML5aq
	0x00a0:  6243 664c 586c 6273 494a 5349 4f62 7451  bCfLXlbsIJSIObtQ
	0x00b0:  5167 4978 4166 5279 2c73 3d4b 4846 3346  QgIxAfRy,s=KHF3F
	0x00c0:  6b43 5169 3966 7736 6f62 4f73 3553 4c63  kCQi9fw6obOs5SLc
	0x00d0:  513d 3d2c 693d 3130 3030 3001 6f6b 0000  Q==,i=10000.ok..
	0x00e0:  0000 0000 00f0 3f00                      ......?.
```
